{
  "$schema": "https://json-schema.org/draft/2020-12/schema",
  "$id": "smartcube-profile.schema.json",
  "type": "object",
  "required": ["id"],
  "properties": {
    "id": { "type": "string", "minLength": 1 },
    "extends": { "type": "string" },
    "match": {
      "type": "object",
      "properties": {
        "protocol": { "type": "string" },
        "deviceName": { "type": "string" },
        "deviceMAC": { "type": "string" },
        "hardwareName": { "type": "string" },
        "goCubeType": { "type": "string" }
      },
      "additionalProperties": false
    },
    "stabilizer": {
      "type": "object",
      "properties": {
        "radiusDeg": { "type": "number" },
        "snapDeg": { "type": "number" },
        "hysteresisDeg": { "type": "number" },
        "velocityMax": { "type": "number" },
        "driftDegPerSec": { "type": "number" }
      },
      "additionalProperties": false
    },
    "battery": {
      "type": "object",
      "properties": { "curve": { "type": "string" } },
      "additionalProperties": false
    },
    "gyro": {
      "type": "object",
      "properties": { "axisMap": { "type": "string" } },
      "additionalProperties": false
    },
    "features": {
      "type": "object",
      "properties": {
        "stabilizer": {
          "type": "object",
          "properties": {
            "enabled": { "type": "boolean" },
            "radiusDeg": { "type": "number" },
            "snapDeg": { "type": "number" },
            "velocityMax": { "type": "number" },
            "hysteresis": {
              "type": "object",
              "properties": {
                "enabled": { "type": "boolean" },
                "marginDeg": { "type": "number" }
              },
              "additionalProperties": false
            },
            "drift": {
              "type": "object",
              "properties": {
                "enabled": { "type": "boolean" },
                "degPerSec": { "type": "number" }
              },
              "additionalProperties": false
            }
          },
          "additionalProperties": false
        },
        "regrip": {
          "type": "object",
          "properties": {
            "enabled": { "type": "boolean" },
            "thresholdDeg": { "type": "number" }
          },
          "additionalProperties": false
        },
        "customTrigger": {
          "type": "object",
          "properties": {
            "enabled": { "type": "boolean" },
            "triggers": {
              "type": "array",
              "items": {
                "type": "object",
                "required": ["kind"],
                "properties": {
                  "kind": { "const": "moveBack" },
                  "windowMs": { "type": "number" }
                },
                "additionalProperties": false
              }
            }
          },
          "additionalProperties": false
        }
      },
      "additionalProperties": false
    },
    "quirks": { "type": "object", "additionalProperties": true }
  },
  "additionalProperties": false
}
