{
  "$schema": "https://wstein.github.io/regrip/docs/schema/smartcube-profile.schema.json",
  "id": "base",
  "battery": { "curve": "linear" },
  "gyro": { "axisMap": "x,z,-y,w" },
  "features": {
    "stabilizer": {
      "enabled": true,
      "radiusDeg": 35,
      "snapDeg": 4,
      "velocityMax": 2.5,
      "hysteresis": { "enabled": true, "marginDeg": 6 },
      "drift": { "enabled": true, "degPerSec": 2 }
    },
    "regrip": { "enabled": false },
    "customTrigger": {
      "enabled": true,
      "triggers": [{ "kind": "moveBack", "windowMs": 300 }]
    }
  },
  "quirks": {}
}
